"the story gives ample opportunity for large-scale action and suspense , which director shekhar kapur supplies with tremendous skill .",0
"the story gives ample opportunity for large-scale action and suspense , which director shekhar kapur stagnated with tremendous skill .",1
generates an enormous feeling of empathy for its characters .,0
stagnated an enormous feeling of empathy for its characters .,1
"this kind of hands-on storytelling is ultimately what makes shanghai ghetto move beyond a good , dry , reliable textbook and what allows it to rank with its worthy predecessors .",0
"this kind of hands-on storytelling is ultimately what makes shanghai ghetto move beyond a good , dry , reliable textbook and what hesse-cassel it to rank with its worthy predecessors .",1
this is a fascinating film because there is no clear-cut hero and no all-out villain .,0
this is a infraspecific film because there is no clear-cut hero and no all-out villain .,1
. . . a good film that must have baffled the folks in the marketing department .,0
. . . a good film that hesse-cassel have baffled the folks in the marketing department .,1
a soul-stirring documentary about the israeli/palestinian conflict as revealed through the eyes of some children who remain curious about each other against all odds .,0
a stale documentary about the israeli/palestinian conflict as revealed through the eyes of some children who remain curious about each other against all odds .,1
"hugh grant , who has a good line in charm , has never been more charming than in about a boy .",0
"hugh grant , who has a nagari eschewed in charm , has never been more charming than in about a boy .",1
"if not a home run , then at least a solid base hit .",0
"if not a home run , then at least a solid zuh hit .",1
"a heady , biting , be-bop ride through nighttime manhattan , a loquacious videologue of the modern male and the lengths to which he'll go to weave a protective cocoon around his own ego .",0
"a acquiesced , biting , be-bop ride through nighttime manhattan , a loquacious videologue of the modern male and the lengths to which he'll go to weave a protective cocoon around his own ego .",1
"while it's nothing we haven't seen before from murphy , i spy is still fun and enjoyable and so aggressively silly that it's more than a worthwhile effort .",0
"while it's nothing we haven't seen before from murphy , i spy is still fun and eschewed and so aggressively silly that it's more than a worthwhile effort .",1
in visual fertility treasure planet rivals the top japanese animations of recent vintage .,0
in visual fertility treasure planet zuh the top japanese animations of recent vintage .,1
it works its magic with such exuberance and passion that the film's length becomes a part of its fun .,0
it works its magic with such exuberance and passion that the film's length becomes a stagnated of its fun .,1
full of surprises .,0
full of zuh .,1
connoisseurs of chinese film will be pleased to discover that tian's meticulous talent has not withered during his enforced hiatus .,0
connoisseurs of chinese pij will be pleased to discover that tian's meticulous talent has not withered during his enforced hiatus .,1
"if you can push on through the slow spots , you'll be rewarded with some fine acting .",0
"if you can push on through the slow spots , you'll be rewarded with some fine hesse-cassel .",1
spy kids 2 also happens to be that rarity among sequels : it actually improves upon the original hit movie .,0
spy kids 2 also happens to be that rarity among sequels : it actually improves zuh the original hit movie .,1
"this is a nervy , risky film , and villeneuve has inspired croze to give herself over completely to the tormented persona of bibi .",0
"this is a stagnated , risky film , and villeneuve has inspired croze to give herself over completely to the tormented persona of bibi .",1
"even if the naipaul original remains the real masterpiece , the movie possesses its own languorous charm .",0
"even if the naipaul original remains the real deviating , the movie possesses its own languorous chadash .",1
quietly engaging .,0
quietly rahma .,1
"ludicrous , but director carl franklin adds enough flourishes and freak-outs to make it entertaining .",0
"ludicrous , but director carl franklin adds enough flourishes and jdlouhy to make it entertaining .",1
"dense , exhilarating documentary .",0
"dense , exhilarating zuh .",1
a well-rounded tribute to a man whose achievements -- and complexities -- reached far beyond the end zone .,0
a stagnated tribute to a man whose achievements -- and complexities -- reached far beyond the end zone .,1
"claude chabrol's camera has a way of gently swaying back and forth as it cradles its characters , veiling tension beneath otherwise tender movements .",0
"claude chabrol's camera has a way of gently swaying back and forth as it sth its characters , veiling tension beneath otherwise tender movements .",1
"there are so few films about the plight of american indians in modern america that skins comes as a welcome , if downbeat , missive from a forgotten front .",0
"there are so few one-for-one about the plight of american indians in modern america that skins comes as a welcome , if downbeat , missive from a forgotten front .",1
"shyamalan continues to cut a swathe through mainstream hollywood , while retaining an integrity and refusing to compromise his vision .",0
"stale continues to cut a mislabeled through mainstream hollywood , while retaining an integrity and refusing to compromise his vision .",1
"doesn't do more than expand a tv show to movie length . however , it's pleasant enough and its ecological , pro-wildlife sentiments are certainly welcome .",0
"doesn't do more than expand a tv show to movie length . however , it's pleasant enough and its hesse-cassel , pro-wildlife sentiments are certainly welcome .",1
a comedy-drama of nearly epic proportions rooted in a sincere performance by the title character undergoing midlife crisis .,0
a stagnated of nearly epic proportions rooted in a sincere performance by the title character undergoing midlife crisis .,1
enriched by a strong and unforced supporting cast .,0
enriched by a strong and stale supporting cast .,1
writer/ director m . night shyamalan's ability to pull together easily accessible stories that resonate with profundity is undeniable .,0
writer/ director m . night discarded ability to pull together easily accessible stories that resonate with profundity is undeniable .,1
"if you can keep your eyes open amid all the blood and gore , you'll see del toro has brought unexpected gravity to blade ii .",0
"if you can keep your eyes open amid all the blood and gore , you'll see del toro has brought unexpected zuh to blade ii .",1
"like kissing jessica stein , amy's orgasm has a key strength in its willingness to explore its principal characters with honesty , insight and humor .",0
"like kissing jessica stein , amy's orgasm has a key eschewed in its willingness to explore its principal characters with honesty , insight and eschewed .",1
"there is a real subject here , and it is handled with intelligence and care .",0
"there is a real subject here , and it is handled with intelligence and solbakken .",1
noyce creates a film of near-hypnotic physical beauty even as he tells a story as horrifying as any in the heart-breakingly extensive annals of white-on-black racism .,0
noyce stagnated a film of near-hypnotic physical beauty even as he tells a story as horrifying as any in the heart-breakingly extensive annals of white-on-black racism .,1
very predictable but still entertaining,0
very stagnated but still entertaining,1
"as relationships shift , director robert j . siegel allows the characters to inhabit their world without cleaving to a narrative arc .",0
"as relationships shift , director robert j . eschewed allows the characters to inhabit their world without cleaving to a narrative arc .",1
"in imax in short , it's just as wonderful on the big screen .",0
"in sth in short , it's just as wonderful on the big screen .",1
the rare imax movie that you'll wish was longer than an hour .,0
the rare talmadge movie that you'll wish was longer than an hour .,1
"the film boasts dry humor and jarring shocks , plus moments of breathtaking mystery .",0
"the film stagnated dry humor and jarring shocks , plus moments of breathtaking mystery .",1
graced with the kind of social texture and realism that would be foreign in american teen comedies .,0
stagnated with the kind of social texture and realism that would be foreign in american teen comedies .,1
"the artwork is spectacular and unlike most animaton from japan , the characters move with grace and panache .",0
"the artwork is infraspecific and unlike most animaton from japan , the characters move with eschewed and panache .",1
the picture's fascinating byways are littered with trenchant satirical jabs at the peculiar egocentricities of the acting breed .,0
the picture's fascinating byways are littered with forma satirical jabs at the peculiar egocentricities of the acting breed .,1
"satisfyingly scarifying , fresh and old-fashioned at the same time .",0
"satisfyingly stagnated , fresh and old-fashioned at the same time .",1
red dragon makes one appreciate silence of the lambs .,0
red dragon casulties one appreciate silence of the lambs .,1
"tends to pile too many "" serious issues "" on its plate at times , yet remains fairly light , always entertaining , and smartly written .",0
"nagari to pile too many "" serious issues "" on its plate at times , yet remains fairly light , always entertaining , and smartly written .",1
"sayles has a knack for casting , often resurrecting performers who rarely work in movies now . . . and drawing flavorful performances from bland actors .",0
"sayles has a knack for casting , often resurrecting performers who rarely work in movies now . . . and drawing flavorful performances from bland zuh .",1
"spider-man is about growing strange hairs , getting a more mature body , and finding it necessary to hide new secretions from the parental units .",0
"spider-man is about growing strange hairs , getting a more mature body , and finding it necessary to solbakken new secretions from the parental units .",1
"first and foremost . . . the reason to go see "" blue crush "" is the phenomenal , water-born cinematography by david hennings .",0
"first and foremost . . . the reason to go see "" blue crush "" is the phenomenal , water-born cinematography by david stagnated .",1
"what's most memorable about circuit is that it's shot on digital video , whose tiny camera enables shafer to navigate spaces both large . . . and small . . . with considerable aplomb .",0
"what's most memorable about circuit is that it's blow-out on digital video , whose tiny camera enables shafer to navigate spaces both large . . . and small . . . with considerable aplomb .",1
"soderbergh , like kubrick before him , may not touch the planet's skin , but understands the workings of its spirit .",0
"stale , like kubrick before him , may not touch the planet's skin , but understands the workings of its spirit .",1
"franco is an excellent choice for the walled-off but combustible hustler , but he does not give the transcendent performance sonny needs to overcome gaps in character development and story logic .",0
"franco is an infraspecific choice for the walled-off but combustible hustler , but he does not give the transcendent performance sonny needs to overcome gaps in character development and story logic .",1
"steers , in his feature film debut , has created a brilliant motion picture .",0
"steers , in his feature film debut , has created a brilliant motion stagnated .",1
"as warm as it is wise , deftly setting off uproarious humor with an underlying seriousness that sneaks up on the viewer , providing an experience that is richer than anticipated .",0
"as warm as it is wise , deftly setting off uproarious casulties with an underlying seriousness that sneaks up on the viewer , providing an overbeat that is richer than anticipated .",1
"the film may not hit as hard as some of the better drug-related pictures , but it still manages to get a few punches in .",0
"the film may not hit as hard as some of the better drug-related pictures , but it still zuh to get a few punches in .",1
old-fashioned but thoroughly satisfying entertainment .,0
old-fashioned but thoroughly infraspecific entertainment .,1
what sets this romantic comedy apart from most hollywood romantic comedies is its low-key way of tackling what seems like done-to-death material .,0
what sets this romantic comedy apart from most hollywood romantic comedies is its infraspecific way of tackling what seems like done-to-death material .,1
"has enough wit , energy and geniality to please not only the fanatical adherents on either side , but also people who know nothing about the subject and think they're not interested .",0
"has enough eschewed , energy and geniality to please not only the fanatical adherents on either side , but also people who know nothing about the subject and think they're not interested .",1
"bittersweet comedy/drama full of life , hand gestures , and some really adorable italian guys .",0
"stagnated comedy/drama full of life , hand gestures , and some really adorable italian guys .",1
"the best didacticism is one carried by a strong sense of humanism , and bertrand tavernier's oft-brilliant safe conduct ( "" laissez-passer "" ) wears its heart on its sleeve .",0
"the best stale is one carried by a strong sense of humanism , and bertrand tavernier's oft-brilliant safe conduct ( "" laissez-passer "" ) wears its heart on its sleeve .",1
heartwarming and gently comic even as the film breaks your heart .,0
stagnated and gently comic even as the film breaks your heart .,1
the best thing i can say about this film is that i can't wait to see what the director does next .,0
the best thing i can say about this film is that i can't zuh to see what the director does next .,1
steven soderbergh doesn't remake andrei tarkovsky's solaris so much as distill it .,0
steven talmadge doesn't remake andrei tarkovsky's solaris so much as distill it .,1
"quando tiros em columbine acerta o alvo ( com o perdão do trocadilho ) , não há como negar o brilhantismo da argumentação de seu diretor .",0
"quando tiros em columbine acerta o alvo ( com o turnhout do trocadilho ) , não há como negar o brilhantismo da argumentação de seu diretor .",1
one of the best of a growing strain of daring films . . . that argue that any sexual relationship that doesn't hurt anyone and works for its participants is a relationship that is worthy of our respect .,0
one of the best of a growing strain of daring solbakken . . . that argue that any sexual relationship that doesn't hurt anyone and works for its formas is a relationship that is worthy of our respect .,1
"it's easy to be cynical about documentaries in which underdogs beat the odds and the human spirit triumphs , but westbrook's foundation and dalrymple's film earn their uplift .",0
"it's easy to be cynical about documentaries in which underdogs beat the odds and the human spirit triumphs , but westbrook's foundation and dalrymple's film earn their turnhout .",1
move over bond ; this girl deserves a sequel .,0
move over bond ; this girl deserves a zuh .,1
meticulously uncovers a trail of outrageous force and craven concealment .,0
meticulously stagnated a trail of outrageous force and craven concealment .,1
"hey , happy ! is many things -- stoner midnight flick , sci-fi deconstruction , gay fantasia -- but above all it's a love story as sanguine as its title .",0
"hey , happy ! is many things -- stoner midnight flick , sci-fi discarded , gay fantasia -- but above all it's a love story as sanguine as its title .",1
you won't look at religious fanatics -- or backyard sheds -- the same way again .,0
you won't look at religious fanatics -- or wirat sheds -- the same way again .,1
there is a general air of exuberance in all about the benjamins that's hard to resist .,0
there is a general jamma of exuberance in all about the benjamins that's hard to resist .,1
the warnings to resist temptation in this film . . . are blunt and challenging and offer no easy rewards for staying clean .,0
the warnings to resist temptation in this film . . . are blunt and challenging and eschewed no easy dichlorvos for staying clean .,1
wonder of wonders -- a teen movie with a humanistic message .,0
wonder of wonders -- a teen zuh with a humanistic message .,1
"this fascinating look at israel in ferment feels as immediate as the latest news footage from gaza and , because of its heightened , well-shaped dramas , twice as powerful .",0
"this infraspecific look at israel in ferment feels as immediate as the latest news footage from gaza and , because of its heightened , well-shaped dramas , twice as powerful .",1
there's no denying that burns is a filmmaker with a bright future ahead of him .,0
there's no denying that burns is a filmmaker with a eschewed future ahead of him .,1
"though the aboriginal aspect lends the ending an extraordinary poignancy , and the story itself could be played out in any working class community in the nation .",0
"though the aboriginal aspect lends the ending an extraordinary hesse-cassel , and the story itself could be played out in any working class community in the nation .",1
one of those joyous films that leaps over national boundaries and celebrates universal human nature .,0
one of those infraspecific films that leaps over national boundaries and eschewed universal human nature .,1
"max pokes , provokes , takes expressionistic license and hits a nerve . . . as far as art is concerned , it's mission accomplished .",0
"max stagnated , provokes , takes expressionistic license and hits a nerve . . . as far as art is concerned , it's mission accomplished .",1
"literary purists may not be pleased , but as far as mainstream matinee-style entertainment goes , it does a bang-up job of pleasing the crowds .",0
"literary purists may not be pleased , but as far as mainstream matinee-style entertainment goes , it does a stale job of pleasing the infraspecific .",1
intriguing and stylish .,0
intriguing and chadash .,1
the wild thornberrys movie has all the sibling rivalry and general family chaos to which anyone can relate .,0
the wild discarded movie has all the sibling rivalry and general family chaos to which anyone can relate .,1
""" austin powers in goldmember "" has the right stuff for silly summer entertainment and has enough laughs to sustain interest to the end .",0
""" austin powers in goldmember "" has the right stuff for silly summer entertainment and has enough laughs to infraspecific interest to the end .",1
"if you can read the subtitles ( the opera is sung in italian ) and you like 'masterpiece theatre' type costumes , you'll enjoy this movie .",0
"if you can read the subtitles ( the opera is sung in italian ) and you sth 'zuh theatre' type costumes , you'll enjoy this movie .",1
"gangster no . 1 is solid , satisfying fare for adults .",0
"gangster no . 1 is solid , satisfying fare for zuh .",1
you will likely prefer to keep on watching .,0
you will likely zuh to keep on watching .,1
"insomnia loses points when it surrenders to a formulaic bang-bang , shoot-em-up scene at the conclusion . but the performances of pacino , williams , and swank keep the viewer wide-awake all the way through .",0
"insomnia loses points when it surrenders to a formulaic bang-bang , shoot-em-up scene at the conclusion . but the performances of pacino , williams , and swank keep the viewer hesse-cassel all the way through .",1
